{
  "$schema": "http://json-schema.org/draft-07/schema#",
  "type": "object",
  "properties": {
    "$schema": {
      "type": "string"
    },
    "Count is {counter}": {
      "additionalProperties": false,
      "description": "Variables: {counter}",
      "properties": {
        "ar": {
          "type": "string"
        },
        "es": {
          "type": "string"
        },
        "zh": {
          "type": "string"
        }
      },
      "type": "object"
    },
    "Documentation": {
      "additionalProperties": false,
      "description": "",
      "properties": {
        "ar": {
          "type": "string"
        },
        "es": {
          "type": "string"
        },
        "zh": {
          "type": "string"
        }
      },
      "type": "object"
    },
    "Edit <code>src/main.ts</code> and save to test <code>HMR</code>": {
      "additionalProperties": false,
      "description": "",
      "properties": {
        "ar": {
          "type": "string"
        },
        "es": {
          "type": "string"
        },
        "zh": {
          "type": "string"
        }
      },
      "type": "object"
    },
    "Get started": {
      "additionalProperties": false,
      "description": "",
      "properties": {
        "ar": {
          "type": "string"
        },
        "es": {
          "type": "string"
        },
        "zh": {
          "type": "string"
        }
      },
      "type": "object"
    },
    "Your questions, answered": {
      "additionalProperties": false,
      "description": "",
      "properties": {
        "ar": {
          "type": "string"
        },
        "es": {
          "type": "string"
        },
        "zh": {
          "type": "string"
        }
      },
      "type": "object"
    }
  },
  "required": [
    "Count is {counter}",
    "Documentation",
    "Edit <code>src/main.ts</code> and save to test <code>HMR</code>",
    "Get started",
    "Your questions, answered"
  ],
  "additionalProperties": false
}
