{
  "$schema": ".schemas/translations.shared.schema.json",
  "Count is {counter}": {
    "ar": "العدد هو {counter}",
    "es": "La cuenta es {counter}",
    "zh": "计数为 {counter}"
  },
  "Documentation": {
    "ar": "وثائق",
    "es": "Documentación",
    "zh": "文档"
  },
  "Edit <code>src/main.ts</code> and save to test <code>HMR</code>": {
    "ar": "عدّل <code>src/main.ts</code> واحفظ لاختبار <code>HMR</code>",
    "es": "Editar <code>src/main.ts</code> y guardar para probar <code>HMR</code>",
    "zh": "编辑 <code>src/main.ts</code> 并保存以测试 <code>HMR</code>"
  },
  "Get started": {
    "ar": "ابدأ الآن",
    "es": "Empezar",
    "zh": "开始使用"
  },
  "Your questions, answered": {
    "ar": "إجابات لأسئلتك",
    "es": "Tus preguntas, respondidas",
    "zh": "你的问题，已有答案"
  }
}
